,title,media,time,host
0,제주 여성 합창단 &#39;레이디스콰이어&#39; 첫 정기연주회,제주의소리,5분 전,
1,&quot;김희철 소셜 계정 비공개가 기삿거리?&quot; 대중 불만 쇄도하는 이유는,뷰어스,9분 전,
2,"김희철, 故 구하라 비보 후 SNS 계정 모두 비공개로 전환 &#39;왜?&#39;",아주경제,9분 전,
3,"김희철 SNS 팔로우 삭제·비공개, 잇다른 비보 때문?",아시아뉴스통신,13분 전,
4,김희철 인스타그램 비공개 전환에 네티즌 놀라 &quot;오빠 힘내세요&quot;...설리 고양이 고블린 입양설은?,금강일보,25분 전,
5,"김희철, 설리·구하라 잇따른 비보에 SNS 비공개 전환·팔로우 &#39;0&#39; 삭제",이투데이,35분 전,
6,"김희철, 故 구하라 비보에 SNS 비공개 전환",머니S,49분 전,네이버뉴스
7,"김희철, 故구하라 비보에 &#39;SNS 팔로우 삭제→비공개 전환&#39;",스타뉴스,1시간 전,네이버뉴스
8,"김희철, 故구하라 비보 이후 SNS 팔로우 삭제→비공개 전환.. “입장 無”",한국일보,1시간 전,네이버뉴스
9,김희철 첫사랑 누구?,천지일보,2시간 전,
10,"김희철, 첫사랑 이별 사연은?..&quot;DVD방서 자꾸 뽀뽀하더라&quot;",디지털타임스,2시간 전,네이버뉴스
11,"김희철, 첫사랑과 헤어진 이유? “DVD방서 자꾸 뽀뽀해서”(‘미우새’)",매일경제,2시간 전,네이버뉴스
12,"김희철, 첫사랑과 결별한 진짜 이유 &quot;22살 때 만난 누나가…&quot;",세계일보,2시간 전,네이버뉴스
13,"&#39;맛남의 광장&#39; 백종원X김희철X양세형X김동준, 두 번째 &#39;맛남의 장소&#39;는?",톱데일리,3시간 전,
14,영월군 주거복지 사각지대 해소 총력,국제뉴스,3시간 전,
15,김희철 최종학력 대학교는? 상지영서대학교…천정명 &quot;김희철과 같은 대학교&quot;,톱스타뉴스,3시간 전,
16,"김희철, 첫사랑과 헤어진 이유는?",머니S,3시간 전,네이버뉴스
17,“DVD방에서...” 김희철이 첫사랑과 헤어진 이유,위키트리,4시간 전,
18,"건보공단, 2019년 대한민국 광고대상 &quot;특별상&quot; 수상",서울와이어,5시간 전,
19,"건보공단, 2019년 대한민국 광고대상 &#39;특별상&#39; 수상",메디컬투데이,5시간 전,
20,‘미우새’ 슬리피 생활고 고백 ‘최고의 1분’…“네티즌 댓글에 상처”,브릿지경제,5시간 전,
21,"&#39;미운우리새끼&#39; 슬리피, 솔직 고백에 최고 시청률 19.6% &quot;사람 많은 곳 잘 못가&quot;",스타데일리뉴스,5시간 전,
22,김희철 첫사랑? &quot;DVD방서 자꾸 뽀뽀해 결별&quot;(&#39;미우새&#39;),데일리한국,6시간 전,
23,"‘한화家 장남’ 김동관, 경영 전면 나서나…연말 인사서 부사장 승진 유력",뉴스웨이,6시간 전,
24,"건보공단, 대한민국 광고대상 특별상 수상",메디칼업저버,6시간 전,
25,정선읍 소재 애산산성 복원 사업 추진,국제뉴스,6시간 전,
26,슬리피 생활고 고백…&quot;돈 없다더니 소고기 먹냐&quot; 악플까지,한국경제TV,6시간 전,네이버뉴스
27,"슬리피 생활고 고백, 19.6% ‘미우새’ 최고의 1분",티브이데일리,7시간 전,
28,"건보공단, 2019년 대한민국 광고대상 &#39;특별상&#39; 수상",데일리팜,7시간 전,
29,&#39;미운우리새끼&#39; 슬리피의 &#39;궁핍한 이야기 Y&#39;..최고 시청률 19.6%,서울경제,7시간 전,네이버뉴스
30,&quot;가난 콘셉트에 상처&quot;..&#39;미우새&#39; 슬리피 생활고 고백에 최고 19.6%,스타뉴스,8시간 전,네이버뉴스
31,"&#39;미우새&#39; 슬리피, 생활고 고백…김건모♥장지연 결혼 비하인드 예고 &#39;日예능 1위&#39;",마이데일리,8시간 전,네이버뉴스
32,슬리피 고백 “지인이 사준 소고기에 ‘돈 없다더니’ 댓글 상처”(‘미우새’),매일경제,8시간 전,네이버뉴스
33,제27회 태백산 눈축제 별빛페스티벌 점등식,국제뉴스,8시간 전,
34,"“축의금도 부담스러워”...‘미우새’ 슬리피, 생활고 고백 ‘분당 최고 19.6%’",텐아시아,8시간 전,네이버뉴스
35,"&#39;미우새&#39; 슬리피, 생활고 고백 화제…시청률은 주춤",스포츠투데이,8시간 전,
36,&#39;미우새&#39; 슬리피 &quot;사람 많은 곳 못가&quot; 생활고 고백…최고의 1분 &#39;19.6%&#39;,엑스포츠뉴스,8시간 전,네이버뉴스
37,"&quot;남이 사준 소고기인데&quot;…슬리피의 생활고 고백, &#39;미우새&#39; 최고의 1분 &#39;19.6%&#39;",SBS funE,8시간 전,네이버뉴스
38,[친절한 리뷰] &#39;미운우리새끼&#39; 슬리피의 생활고 고백…최고시청률 19.6% 기록,아시아투데이,8시간 전,
39,&#39;미운 우리 새끼&#39; 슬리피의 생활고 고백…최고의 1분 19.6%,스포츠서울,8시간 전,네이버뉴스
40,"&#39;미우새&#39; 슬리피, &#39;궁핍한이야기 Y&#39; 생활고 사연 먹먹...최고시청률 19.6%",싱글리스트,8시간 전,
41,슬리피 생활고 “사람 많은 곳 못가”…‘미우새’ 최고 19.6% [MK★TV시청률],MK스포츠,8시간 전,네이버뉴스
42,‘미우새’ 슬리피 “생활고 고백 후 불쌍하게 볼까 사람 많은 곳 못가” [M+TV인사이드],MBN,8시간 전,네이버뉴스
43,"김희철 “22살 때 첫사랑, DVD방서 자꾸 뽀뽀해 결별”[결정적장면]",뉴스엔,8시간 전,네이버뉴스
44,"“지인이 사준 것 뿐인데”… ‘미우새’ 슬리피의 생활고 고백, 19.6% 최고의 1분 [간밤TV]",스포츠경향,8시간 전,네이버뉴스
45,&quot;지인이 사준 것 뿐인데&quot;…&#39;미우새&#39; 슬리피의 생활고 고백 &#39;최고의1분 19.6%&#39;,스포츠조선,8시간 전,네이버뉴스
46,‘미운우리새끼’ 슬리피 생활고 고백 “지인이 사준 것뿐인데” 19.6% 최고의 1분,스포츠동아,9시간 전,네이버뉴스
47,[간밤의 TV] 미우새 “지인이 사준 것 뿐인데” 슬리피의 생활고 고백 &#39;최고의 1분&#39;,아주경제,9시간 전,
48,"&#39;미우새&#39; &quot;지인이 사준 것 뿐인데&quot; 슬리피, 생활고 고백‥최고의 1분",헤럴드POP,9시간 전,네이버뉴스
49,"‘미우새’ 슬리피 생활고 고백에 시청률 19.6%, 최고의 1분",뉴스엔,9시간 전,네이버뉴스
50,"&quot;자꾸 뽀뽀하잖아&quot; &#39;미우새&#39; 김희철, 22살 첫사랑과 헤어진 이유[핫TV]",OSEN,9시간 전,네이버뉴스
51,"[어게인TV]&#39;미우새&#39; 김희철, SM오디션 붙었던 원주 미용실→알바하던 고깃집 찾았다",헤럴드POP,10시간 전,네이버뉴스
52,"&quot;사람들이 쌀도 보내줘&quot;…&#39;미우새&#39; 슬리피, 담담한 생활고 고백[SS리뷰]",스포츠서울,10시간 전,네이버뉴스
53,김환기 &#39;우주&#39; 송자호 낙찰?,충청리뷰,10시간 전,
54,"‘미우새’ 최시원 “김희철과 한 침대 사용, 선 넘으면 큰일 난다”",MBN,13시간 전,네이버뉴스
55,AFOB 발전기여 감사패 수상,인천일보,14시간 전,
56,나눔과 포용 실천한 &#39;기초단체 4곳&#39; 선정,인천일보,14시간 전,
57,"&#39;미운 우리 새끼&#39; 김희철, 20대 때 다닌 미용실 발견…리즈 시절 미모는?",톱스타뉴스,15시간 전,
58,"&#39;미우새&#39; 김희철, &quot;22살 때 만난 첫 여친, DVD방에서 자꾸 뽀뽀해서 헤어져&quot;",한국경제,16시간 전,네이버뉴스
59,김희철 &quot;첫 여친은 22살 때…자꾸 뽀뽀하려고 해서 헤어져&quot; 폭소 (&#39;미우새&#39;),마이데일리,17시간 전,네이버뉴스
60,"김희철, 첫사랑 고백 &quot;누나가 자꾸 뽀뽀해서 헤어졌어&quot;",스트레이트뉴스,17시간 전,
61,"과거 성형 고백했는데…고향 지인, 김희철 자연 미인으로 알아봐",울산종합일보,17시간 전,
62,러브장 무엇?..&quot;사귀는 동안 매일 편지를 쓴다&quot;,스페셜경제,17시간 전,
63,자연 미인 인증받은 김희철?…과거 코 수술 고백 &quot;성형 욕구 샘 솟아&quot;,뷰어스,17시간 전,
64,"김희철 친구 건희 누구? 20년 넘는 진짜 친구, &#39;스타킹&#39;서 화려한 퍼포먼스",내외경제tv,17시간 전,
65,"김희철 친구 건희, `스타킹`에도 출연했다? 직업 뭐길래, 다른 슈퍼주니어 멤버들과도 친분",FAM타임스,17시간 전,
66,김희철 &quot;처음 여자친구 생긴 건 22살?&quot;,스페셜경제,17시간 전,
67,"최시원, 남다른 학창시절 사진 보니? &#39;귀티좔좔&#39;",브릿지경제,17시간 전,
68,"&quot;러브장, 어릴 때 이러고 놀았다고?&quot;…&#39;미우새&#39; 김희철 &#39;깜짝&#39;",데일리한국,17시간 전,
69,"최시원 &quot;김희철 진정한 모습, 경락받을 때 나온다&quot;",부산일보,17시간 전,네이버뉴스
70,"[종합] `미우새` 김희철, 우주대스타 금의환향... 김건모, 예비신부에 피아노 프러포즈",매일경제,18시간 전,네이버뉴스
71,"김희철 친구 건희, 러브장 추억소환? “너에게만 주고 싶은 우유”",환경일보,18시간 전,
72,"&#39;미우새&#39; 이상민X슬리피, 생활고 잊은 힐링데이…김건모, 장지연 위한 눈물 이벤트[종합S]",스포티비뉴스,18시간 전,네이버뉴스
73,"[스브스夜] &#39;미우새&#39; 이상민, 생활고 털어놓은 슬리피에 &quot;당분간 고기 무한리필&quot; 응원",SBS funE,18시간 전,네이버뉴스
74,"[종합]&#39;미우새&#39; 슬리피, 위축된 상추 3장…이상민 &quot;2장씩 싸먹어라&quot;",헤럴드POP,18시간 전,네이버뉴스
75,최시원 &#39;미우새&#39;서 &quot;김희철과 한 침대 썼다. 고충 알아&quot;,아시아뉴스통신,18시간 전,
76,"`미우새` 최시원, &quot;희철이 형 섬세해서 선 넘으면 발길질 해&quot;",매일경제,18시간 전,네이버뉴스
77,김희철 원주 진광중학교 찾아 확인한 성적표 보니,국제신문,18시간 전,
78,"&#39;미우새&#39; 최시원, 신동엽 황당 미담 공개→딸에게 소개해주기 싫은 아들은 김희철",스포티비뉴스,18시간 전,네이버뉴스
79,"이상민·슬리피, 생활고 선·후배의 무한리필 소고기뷔페 맛집行…딘딘, 김종국에 &#39;돌&#39; 선물? 김희철, 고향 원주서 첫사랑 공개! &#39;미운우리새끼&#39; [★픽]",톱스타뉴스,19시간 전,
80,&#39;미우새&#39; 김희철 母 &quot;슈퍼주니어 비주얼 담당? 최시원 아닌 아들&quot;,스포츠투데이,19시간 전,
81,"장지연♥김건모, 프로포즈 현장 공개 &quot;그대와 나 영원히&quot; 감동! 부부의 나이 차이는? 결혼은 5월로 연기 &#39;미운우리새끼&#39; [★픽] ",톱스타뉴스,19시간 전,
82,"&#39;미우새&#39; 최시원 &quot;김희철 모습, 경락받을 때 나오더라&quot; 너스레",SBS funE,19시간 전,네이버뉴스
83,최시원 만난 김희철 母 &quot;슈퍼주니어 비주얼담당(비담)은…&quot; 나이는? &#39;미운우리새끼&#39; [★픽],톱스타뉴스,19시간 전,
84,‘미우새’ 신동엽 “김건모 결혼 축하…못갈 줄 알았는데 천사가 나타났다”,MK스포츠,19시간 전,네이버뉴스
85,"&#39;미우새&#39; 김희철 母, 최시원 출연에 &quot;슈퍼주니어 비주얼 담당? 김희철&quot;",비즈엔터,20시간 전,
86,"[친절한 프리뷰] &#39;미운우리새끼&#39; 슈퍼주니어 최시원, 이름 만큼 시원한 입담",아시아투데이,20시간 전,
87,"‘미운 우리 새끼’ 슬리피, 담담하게 ‘생활고’ 고백",뉴스컬처,20시간 전,
88,"[TV알리미] ‘미우새’ 최시원, 김희철母 진땀 흘리게 한 사연은?",스포츠월드,20시간 전,네이버뉴스
89,"&#39;미운우리새끼&#39; 딘딘, 김종국 집 방문 &amp; 슬리피 생활고, 이상민 소고기 무한리필 뷔페 즐기는 법 공개 &amp; 진광중학교 찾은 김희철 첫사랑 스토리-러브장",대전투데이,20시간 전,
90,"&#39;미우새&#39; 김종국 집 방문한 딘딘, 경악할 선물 정체는? &amp; 슬리피 생활고, 이상민 소고기 무한리필 뷔페 즐기는 법 공개 &amp; 진광중학교 찾은 김희철 첫사랑 스토리-러브장",농업인신문,20시간 전,
91,"김희철 시의원, 아시아생물공학연합체 감사패 받아",경기신문,21시간 전,
92,&#39;미운우리새끼&#39; 최시원 &quot;김희철 감정기복… 기분 좋아지면 걱정돼&quot; 폭로,중부일보,21시간 전,
93,"김희철, 나이 37세 실화? 고양이 사건? &#39;키+학력&#39;...&quot;인스타그램 속 햄버거 먹방&quot;",내외경제tv,21시간 전,
94,‘맛남의 광장’ 측 “내일(25일) 덕유산 휴게소서 두 번째 장사 시작”,매일경제,22시간 전,네이버뉴스
95,진정한 &#39;금수저&#39; AOA 찬미 &quot;母 청소년들에게 무료숙식제공&quot;,머니투데이,23시간 전,네이버뉴스
96,‘미우새’ 최시원 “김희철과 한 침대 쓸 때 매일밤 눈물”,서울신문,23시간 전,네이버뉴스
97,"&#39;미우새&#39; 최시원, 김희철 폭풍 폭로로 김희철母 당황",스포츠조선,1일 전,네이버뉴스
98,백종원 덕유산에 떴다…‘맛남의 광장’ 메뉴 출시,스포츠월드,1일 전,네이버뉴스
99,‘맛남의 광장’ 두 번째 ‘맛남의 장소’는 덕유산 휴게소…전북 장수군의 특산물 음식은?,스포츠경향,1일 전,네이버뉴스
100,백종원 덕유산에 떴다…‘맛남의 광장’ 메뉴 출시,스포츠월드,1일 전,네이버뉴스
101,‘맛남의 광장’ 두 번째 ‘맛남의 장소’는 덕유산 휴게소…전북 장수군의 특산물 음식은?,스포츠경향,1일 전,네이버뉴스
102,다음주 &#39;아형&#39; 나와 사장님 박진영에게 반말로 &#39;극딜&#39;하는 트와이스 다현,인사이트,1일 전,
103,"&#39;맛남의 광장&#39; 백종원X김희철, 덕유산 휴게소 오픈…전북 장수군 특산음식은?",싱글리스트,1일 전,
104,"&#39;미운 우리 새끼&#39; 최시원, 시원시원한 입담으로 母벤져스 맘심 저격",서울경제,1일 전,네이버뉴스
105,"&#39;맛남의 광장&#39; 백종원·양세형·김희철·김동준, 25일 덕유산 휴게소 뜬다[공식]",OSEN,1일 전,네이버뉴스
106,&#39;맛남의 광장&#39; 덕유산 휴게소 방문…25일 11시 30분부터 장사 오픈,엑스포츠뉴스,1일 전,네이버뉴스
107,&#39;미우새&#39; 최시원 &quot;김희철 기분 좋아지면 걱정돼&quot; 연이은 폭로,스포츠한국,1일 전,
108,"정준하 깍두기 레시피, 미운 우리 새끼 재방송에 관심 집중",넥스트데일리,1일 전,
109,“어머니가...” 진짜 금수저 중의 금수저라는 AOA 찬미,위키트리,1일 전,
110,정선군 내년 예산 4510억원 역대 최대규모,국제뉴스,1일 전,
111,[人더컬처] 새 소속사 찾은 정모 “신해철 선배가 소개해준 느낌이에요”,브릿지경제,1일 전,
112,&#39;미운 우리 새끼&#39; 김희철母 진땀 흘리게 한 최시원의 폭풍 폭로는?,스타데일리뉴스,1일 전,
113,"&#39;미우새&#39; 최시원, 김희철母 진땀 흘리게 한 폭풍 폭로 [포인트:컷]",엑스포츠뉴스,1일 전,네이버뉴스
114,"&#39;미우새&#39; 최시원 &quot;슈주 멤버들, 김희철 기분 좋아지면 걱정&quot;",일간스포츠,1일 전,네이버뉴스
115,153억 김환기 &#39;우주&#39; 누가 샀을까?...동원건설家 구매 소문,뉴시스,1일 전,네이버뉴스
116,"‘미우새’ 최시원, 김희철과 한 침대 쓰며 눈물 흘린 사연은?",매일경제,1일 전,네이버뉴스
117,&#39;미우새&#39; 최시원 &quot;김희철과 한 침대 사용..매일밤 울었다&quot;,스타뉴스,1일 전,네이버뉴스
118,"&#39;미우새&#39; 슈주 최시원, 김희철 폭로·사이다 입담 &#39;맘심 저격&#39;",싱글리스트,1일 전,
119,‘미우새’ 최시원 “매일 밤 눈물로 베개 적셔” 김희철母 진땀,스포츠동아,1일 전,네이버뉴스
120,"‘미우새’ 최시원 “멤버들, 김희철 기분 좋아지면 걱정”…김기복 면모 공개",한국일보,1일 전,네이버뉴스
121,&#39;미우새&#39; 최시원 &quot;김희철과 한 침대 쓸 때 매일 밤 눈물로 베개 적셨다&quot;,텐아시아,1일 전,네이버뉴스
122,"&#39;미운 우리 새끼&#39; 최시원 &quot;김희철 기분 좋아지면 걱정된다&quot;, 왜?",매일신문,1일 전,네이버뉴스
123,"&#39;미우새&#39; 최시원, 시원한 입담…모벤져스 &quot;말을 어쩜 그리 재밌게~&quot;",SBS funE,1일 전,네이버뉴스
124,&#39;미운 우리새끼&#39; 최시원 &quot;김희철과 한 침대 써.. 매일 눈물 흘려&quot;,이데일리,1일 전,네이버뉴스
125,"[투데이TV]&#39;미우새&#39; 최시원, 스페셜MC 출격…시원시원 입담에 母벤져스 극찬",헤럴드POP,1일 전,네이버뉴스
126,"&#39;미우새&#39; 슈퍼주니어 최시원, 김희철母 진땀 흘리게 한 폭로는?",OSEN,1일 전,네이버뉴스
127,최시원 ‘미우새’ 출격 “김희철 관련 폭로에 母 진땀”[오늘TV],뉴스엔,1일 전,네이버뉴스
128,&#39;썸바이벌1+1&#39; 강승연 PD &quot;리얼한 썸에 초점…실제 커플 탄생하기도&quot;[SS인터뷰①],스포츠서울,1일 전,네이버뉴스
129,"강승연 PD &quot;김기범, &#39;썸바이벌1+1&#39; 후 밝아졌다며 고맙다고 연락…시즌2도 기대&quot;[SS인터뷰②]",스포츠서울,1일 전,네이버뉴스
130,"[종합] &#39;아는형님&#39; 206회, &quot;그게 몇 화야?&quot;설현 키스신 에피소드 대공개! ...AOA 탈퇴멤버 제외한 5인조 컴백, 문 헌터(Moon-Hunter) 콘셉트 신곡 무대 공개",톱스타뉴스,1일 전,
131,"&#39;아는형님&#39; 206회, &quot;진짜 많이 힘들었잖아 우리&quot; AOA 탈퇴멤버 초아, 민아... 5인조 컴백을 위해 &#39;고마움&#39; 언급 (2)",톱스타뉴스,1일 전,
132,"AOA “데뷔 시절 천사 이름 있었다, 우리의 흑역사”",뉴스엔,1일 전,네이버뉴스
133,"&#39;아는형님&#39; 206회, 3년 만에 다시 온 &#39;날 보러 와요高&#39; AOA ...&quot;퀸덤 때 초심으로&quot; 성공적인 5인조 재편성과 재계약을 한 AOA (1)",톱스타뉴스,1일 전,
134,"이노경영기술원, 호텔수성서 ‘미얀마 양곤 투자설명회’",영남일보,2일 전,
135,"&#39;아는 형님&#39; AOA, 설현 허벅 장단 대결 신청",글로벌이코노믹,2일 전,
136,&#39;116㎏→99㎏&#39; 신동 체중감량 비법은? &quot;4주 만에 17㎏ 빼려면…&quot;,세계일보,3일 전,네이버뉴스
137,영월군 창업 지원사업 참여 청년창업자 모집,국제뉴스,3일 전,
138,"정선군, 군민안전 방범용 CCTV 31대 추가 설치",국제뉴스,3일 전,
139,"[종합] 신동 체중감량, 동료들 응원 봇물…4주만에 놀라워",스포츠동아,3일 전,네이버뉴스
140,"신동, 17kg 감량 근황 공개…&quot;몰라보게 달라진 비주얼&quot;",영남일보,3일 전,
141,이소라는 20년 전 강호동과 예능에서의...? `아는형님`,일간리더스경제,3일 전,
142,당당한 워킹으로... 아는 형님,경남데일리,3일 전,
143,"신동 17kg 체중감량, 116kg→ 99kg...“절반도 안 왔다”",매일경제,3일 전,네이버뉴스
144,"김희철 고시회 사업부회장 &quot;세무사법 개정안, 헌재 판결 취지대로 해결돼야&quot;",세정신문,3일 전,
145,이소라는 모델 출신답게 당당하게 워킹을 하며 교실에… &quot;아는형님&quot;,인사이트코리아,3일 전,
146,이소라는 무리한 다이어트로 실신한 적 있다고 밝혔다??? 아는 형님,경인매일,3일 전,
147,"&#39;미운 우리 새끼&#39; 김희철, 금발 왕자 비주얼로 햄버거 먹방…&quot;19살 때 공장에서 먹었던&quot;",톱스타뉴스,3일 전,
148,결혼정보회사 퍼플스가 말하는 상위 1% 신혼집은 어디일까?,한국목재신문,3일 전,
149,"태백시, &#39;대한민국 겨울축제 부문&#39; 2년 연속 최우수상",국제뉴스,3일 전,
150,&#39;아는형님&#39; 소통하기 위해 시작했다고 설명했다,광명지역신문,3일 전,
151,&#39;아는형님&#39; 앨범 뮤직비디오에 출연할 수 있었다,말산업저널,3일 전,
152,&#39;미운 우리 새끼&#39; 결방 후 슬리피 &#39;생활고&#39; 고백-김희철VS최시원 &#39;비주얼&#39; 대결 예고  ,톱스타뉴스,3일 전,
153,[인터뷰] VSG TV &quot;상생모델로 게임업계 힘 보탤 것&quot;,머니S,4일 전,네이버뉴스
154,정선군 가수리 가탄마을에 동강 전통 섶다리 재현,국제뉴스,4일 전,
155,"정선군자원봉사센터, 읍·면 순회 간담회 개최",국제뉴스,4일 전,
156,"영월군, 관내 농업인 대상 불용농기계 우선매각",국제뉴스,4일 전,
157,"지연되는 지방도 공사, 50년 걸려야 마무리",목포MBC,4일 전,
158,"신재생에너지협회, 문철환 상근부회장 선임",이투뉴스,4일 전,
159,"이정은, 이효리 연기 스승된 이유? &quot;결정적인 순간에…&quot;",이코노믹리뷰,4일 전,
160,&#39;아는형님&#39; 모델 이소라 &quot;이상민 때문에 고소영에게도 안 판 옷 버렸다&quot;,조이뉴스24,4일 전,
161,"이정은, 알고보니 이효리 연기 스승? &quot;결정적인 순간에…&quot;",EBN,4일 전,
162,"지연되는 지방도 공사, 50년 걸려야 마무리",목포MBC,4일 전,
163,"지연되는 지방도 공사, 50년 걸려야 마무리",광주MBC,4일 전,
164,"안미나, 故 마광수 과제 김희철에 도움 요청? “만나기만 하면 그 이야기”",환경일보,4일 전,
165,"신재생에너지協, 문철환 상근부회장 취임",가스신문,4일 전,
166,"신재생에너지協, 문철환 신임 상근부회장 선임",투데이에너지,5일 전,
167,[김희철의 전쟁사](15) 미 7사단의 압록강 기념촬영은 맥아더 추락과 더 많은 피를 불러와,뉴스투데이,5일 전,
168,"정선군의회, &quot;농·특산물 품목의 홍보 마케팅 전략은?&quot;",국제뉴스,5일 전,
169,"&#39;아는형님&#39; 이소라 &quot;이상민, 전세계 2개 가죽재킷 망쳤다&quot; 이상민 &quot;지금은 못 사줘&quot;",한국스포츠통신,5일 전,
170,"사회연대은행, 사회복지공동모금회등과 함께 금융취약계층 지원 나서",데일리경제,5일 전,
171,"태백시의회, 제242회 2차 정례회 개최",국제뉴스,5일 전,
172,`아는 형님` 이소라는 첫 등장부터 남다른!,말산업저널,5일 전,
173,&quot;아는형님&quot; 누나들과 나오는 이유를?,광명지역신문,5일 전,
174,"아는 형님, 등장부터 남다른 존재감을 과시했다?",블록체인밸리,5일 전,
175,"&#39;아는형님&#39; 이소라, 유튜브 시작한 계기 &quot;젊은 사람들과 소통하기 위해&quot;",경상일보,5일 전,
176,"&#39;전현무와 새벽 1시 호텔에서 마주쳐&#39; 문가영 나이, 근황? 집안 눈길",공감신문,5일 전,
177,"문가영 나이? 전현무와 새벽 1시 호텔에서 마주쳐, 집안 등 &#39;재조명&#39;",내외경제tv,5일 전,
178,"썸바이벌1+1, 여자 솔로 연예인 특집 남자 솔로 연예인특집 보다 인기",충청리뷰,5일 전,
179,산업부 &quot;제조업 르네상스 성과 창출・투자활성화 주력&quot;,에너지데일리,6일 전,
180,"사회연대은행, 취약계층에 긴급대출…&#39;사랑의 금융 119&#39; 스타트",아이뉴스24,6일 전,네이버뉴스
181,성윤모 &quot;제조업 르네상스 위해 성과창출과 투자활성화 주력&quot;,뉴스웍스,6일 전,
182,"사회연대은행, ‘사랑의 금융 119’ 진행… 관계기관과 협약",여행레저신문,6일 전,
183,성윤모 &quot;제조업 활성화 위해 법 정비·세제 지원&quot;,아주경제,6일 전,
184,"대기업 CEO 불러모은 성윤모, 제조업 르네상스 공치사",스카이데일리,6일 전,
185,[사진] &#39;제1차 제조업 르네상스 라운드테이블&#39;,뉴스핌,6일 전,
186,성윤모 &quot;제조업 수출·고용 어려워..미흡한 정책 과감히 보완하겠다&quot;,파이낸셜뉴스,6일 전,네이버뉴스
187,제조업 르네상스 라운드 테이블,뉴시스,6일 전,네이버뉴스
188,"(참고자료)산업부, 제조업 르네상스를 위한 성과창출과 투자활성화에 주력",정책브리핑,6일 전,네이버뉴스
189,성윤모 산업부 장관 &quot;신산업 민간 투자 적기 지원&quot;,전자신문,6일 전,네이버뉴스
190,"정부-업계, ‘제조업 르네상스 라운드 테이블’ 개최",디지털데일리,6일 전,네이버뉴스
191,성윤모 산업 장관 “민간 투자 계획 적기 이행위해 1대1 밀착지원”,헤럴드경제,6일 전,네이버뉴스
192,"&#39;글로벌 인기남&#39; 방탄소년단 정국, &#39;슈퍼스타 배우→래퍼&#39; 국적·성별 불문한 &quot;셀렙 중 최고&quot;",세계일보,6일 전,네이버뉴스
193,성윤모 산업장관 &quot;정부 정책에 민간 350조 원 투자로 화답…車·조선 반등 전기 마련&quot;,이투데이,6일 전,
194,"산업부 제조업 르네상스 중간점검…&quot;순환 생태계 조성, 투자 활성화 집중&quot;",IT조선,6일 전,
195,성윤모 산업부 장관 &quot;제조업 르네상스 성과 주력&quot;,뉴스핌,6일 전,
196,성윤모 산업장관 &quot;국내 투자에 과감한 세제혜택 지원”,머니투데이,6일 전,네이버뉴스
