,title,media,time,host
197,성윤모 &quot;제조업 르네상스 위해 투자법령 정비·세제 지원&quot;,연합뉴스,6일 전,네이버뉴스
198,"정선소방서, 삼탄아트마인에서 합동소방훈련",국제뉴스,6일 전,
199,&#39;2019강원문화 대축전&#39; 20일 정선아리랑센터에서 열린다,국제뉴스,6일 전,
200,태백시 황연동 댄스동아리 &#39;푸아니니&#39; 널리 알린다,국제뉴스,6일 전,
201,"&#39;김희철과의 연결고리는 엄마 견미리&#39; 이유비 나이, 근황? 과거 방송 눈길",공감신문,6일 전,
202,"이유비 나이? 김희철과의 연결고리는 엄마 견미리, 과거 방송 &#39;재조명&#39;",내외경제tv,6일 전,
203,IFEZ &quot;외자 유치서 산업 육성으로 변경해야&quot;,경인일보,6일 전,
204,"검찰, &#39;강원랜드 채용비리&#39; 염동열 의원 징역 3년 구형",국제뉴스,6일 전,
205,"&#39;음악당&#39;, 밴드 새소년 출연... 김이나-배순탁, 팬심 드러내 &#39;눈길&#39;",스타데일리뉴스,6일 전,
206,모델 이소라 &quot;다이어트 콘텐츠 제작? 이제 그 여자는 없다&quot;,조이뉴스24,6일 전,
207,중소기업 최고경영자과정(KBIZ AMP) 제13기 수료식 개최,한국경제,6일 전,네이버뉴스
208,"중기중앙회, KBIZ AMP 제13기 수료식 개최",아시아투데이,6일 전,
209,중소기업 최고경영자과정 13기 수료식 개최,이투데이,6일 전,
210,"중기중앙회, 중소기업 최고경영자과정 제13기 수료식 개최",뉴스핌,6일 전,
211,"중기중앙회, &#39;KBIZ 中企 최고경영자과정&#39; 13기 수료식 개최",뉴스1,6일 전,네이버뉴스
212,"정선군, 도내 첫 버스완전공영제 추진",국제뉴스,7일 전,
213,미얀마 양곤 이노시티 복합부동산 투자설명회,한국일보,7일 전,네이버뉴스
214,"태백산국립공원, 함백산 폐전신주 철거 완료",국제뉴스,7일 전,
215,"인디 밴드 새소년, &#39;음악당&#39; 출연..김이나-김희철-배순탁도 감탄[공식]",헤럴드POP,7일 전,네이버뉴스
216,"[김희철의 전쟁사](14) 이승만이 맛본 수통의 압록강물, 통일 기쁨은 비극의 시작",뉴스투데이,7일 전,
217,"모델 이소라, 손미나 전 아나운서와 다정한 모습…&#39;나이-결혼 여부에 관심↑&#39;",톱스타뉴스,7일 전,
218,‘아는형님’ 이소라 “이상민 때문에 세상에 2개뿐인 옷 버려” 20년 앙금 고백,스포츠조선,7일 전,네이버뉴스
219,"영월군, 지역정착지원형 청년일자리 사업 참여자 모집",국제뉴스,7일 전,
220,"태백시노인복지관, 프로그램 발표회 및 작품 전시회 개최",국제뉴스,7일 전,
221,EBS 펭수 “내 꿈은 우주대스타” 발언에 뿔난 아이돌 팬덤 [헉스],파이낸셜뉴스,7일 전,네이버뉴스
